Product ID,Title,URL
online:en:IE:79857,FAIPLUG16MM FAITHFULL PLUG CUTTER 16MM,https://www.kennyfuels.ie/product/plug-cutter-16mm/
online:en:IE:80088,DHT058018 DEWALT NAIL PUNCH 3 PC SET,https://www.kennyfuels.ie/product/bi-material-nail-punch-set-3-piece/
online:en:IE:80152,DHT014674 DEWALT ERGO AVIATION SNIP - RIGHT,https://www.kennyfuels.ie/product/right-cut-ergo-aviation-snips/
online:en:IE:80077,DHT014675 DEWALT ERGO AVIATION SNIP - STRAIGHT,https://www.kennyfuels.ie/product/straight-cut-ergo-aviation-snips/
online:en:IE:80021,DHT536915 DEWALT TOUGH TAPE 5M/16,https://www.kennyfuels.ie/product/toughseries-tape-measure-5m-16ft-width-32mm/
online:en:IE:80066,DHT046032 DEWALT 12IN SQUARE,https://www.kennyfuels.ie/product/rafter-layout-square-12in/
online:en:IE:77404,SCAN CUT D GLOVE - PU PALM SZ 9,https://www.kennyfuels.ie/product/scan-cut-d-glove-pu-palm-sz-9/
online:en:IE:90234,MAKDJR186Z MAKITA RECIPROCATING SAW 18V BARE UNIT,https://www.kennyfuels.ie/product/makdjr186z-makita-reciprocating-saw-18v-bare-unit/
online:en:IE:78194,DEWDCS369N DEWALT 18V XR BRUSHLESS COMPACT RECIP SAW BARE,https://www.kennyfuels.ie/product/dewalt-dcs369n-xr-18v-brushless-reciprocating-saw-bare-unit/
online:en:IE:80083,DHT051002 DEWALT CURVE-CLAW HAMMER ONE PIECE - 16OZ 454G,https://www.kennyfuels.ie/product/curve-claw-smooth-face-hammer-454g-16oz/
online:en:IE:79853,FAIPLUG10 FAITHFULL PLUG CUTTER NO.10,https://www.kennyfuels.ie/product/plug-cutter-no-10/
online:en:IE:80029,DHT536926 DEWALT TOUGH TAPE 8M/26,https://www.kennyfuels.ie/product/toughseries-tape-measure-8m-26ft-width-32mm/
online:en:IE:78168,DEWDCF900N DEWALT 18V XR BLESS 1/2IN HT IMP WRENCH HR BARE,https://www.kennyfuels.ie/product/dewalt-18v-xr-bless-1-2in-ht-imp-wrench-hr-bare/
online:en:IE:79668,FAIJBT118B FAITHFULL JIGSAW BLADES (5) METAL T118B,https://www.kennyfuels.ie/product/metal-cutting-jigsaw-blades-pack-of-5/
online:en:IE:79661,FAIJBT101DP FAITHFULL JIGSAW BLADES (5) WOOD T101DP,https://www.kennyfuels.ie/product/wood-jigsaw-blades-pack-of-5-2/
online:en:IE:80064,DHT046031 DEWALT 7IN SQUARE,https://www.kennyfuels.ie/product/rafter-layout-square-7in/
online:en:IE:79654,FAIJBT101B FAITHFULL JIGSAW BLADES (5) WOOD T101B,https://www.kennyfuels.ie/product/wood-jigsaw-blades-pack-of-5-t101b/
online:en:IE:80068,DHT010261 DEWALT FOLDING LOCKING RETRACTABLE KNIFE,https://www.kennyfuels.ie/product/folding-retractable-auto-load-utility-knife/
online:en:IE:79850,FAIPLUG6 FAITHFULL PLUG CUTTER NO.6,https://www.kennyfuels.ie/product/plug-cutter-no-6/
online:en:IE:80081,DHT020547 DEWALT 5-IN-1 HACKSAW - 300MM BLADE,https://www.kennyfuels.ie/product/5-in-1-hacksaw-300mm-12in/
online:en:IE:80033,DHT538113 DEWALT COMPACT TAPE 5M/16,https://www.kennyfuels.ie/product/compact-series-tape-measure-5m-16ft-width-28mm/
online:en:IE:80057,DHT043248 DEWALT BOX BEAM LEVEL - 120CM / 4FT,https://www.kennyfuels.ie/product/box-beam-level-120cm/
online:en:IE:90231,MAKDHR165ZJ MAKITA ROTARY HAMMER DRILL 18V BARE UNIT,https://www.kennyfuels.ie/product/makdhr165zj-makita-rotary-hammer-drill-18v-bare-unit/
online:en:IE:79681,FAIJBT244D FAITHFULL JIGSAW BLADES (5) WOOD T244D,https://www.kennyfuels.ie/product/wood-jigsaw-blades-pack-of-5-7/
online:en:IE:79845,FAICA13 FAITHFULL COMB AUGER BIT 13MM X 200MM 0/L,https://www.kennyfuels.ie/product/combination-wood-auger-bit-13-x-200mm/
online:en:IE:80075,DHT711004 DEWALT UTILITY BLADES 75PK,https://www.kennyfuels.ie/product/induction-hardened-utility-blades-dispenser-of-75/
online:en:IE:80085,DHT051004 DEWALT RIP-CLAW HAMMER ONE PIECE - 20OZ 567G,https://www.kennyfuels.ie/product/rip-claw-smooth-face-hammer-567g-20oz/
online:en:IE:80154,DHT055529 DEWALT MOULDING BAR 250MM,https://www.kennyfuels.ie/product/moulding-bar-250mm/
online:en:IE:80037,DHT043172 DEWALT BOX BEAM LEVEL - 180CM / 6FT,https://www.kennyfuels.ie/product/box-beam-level-180cm/
online:en:IE:80031,DHT536933 DEWALT TOUGH TAPE 10M/33,https://www.kennyfuels.ie/product/toughseries-tape-measure-10m-33ft-width-32mm/
online:en:IE:80035,DHT538127 DEWALT COMPACT TAPE 8M/26,https://www.kennyfuels.ie/product/compact-series-tape-measure-8m-26ft-width-28mm/
online:en:IE:90212,BAH9029GTP PHOSPHATE GREEN ERGO ADJ WRENCH 170MM,https://www.kennyfuels.ie/product/bah9029gtp-phosphate-green-ergo-adj-wrench-170mm/
online:en:IE:79674,FAIJBT119BO FAITHFULL JIGSAW BLADES (5) WOOD T119BO,https://www.kennyfuels.ie/product/wood-jigsaw-blades-pack-of-5-5/
online:en:IE:80117,DHT074432 DEWALT V-JAW PUSH LOCK PLIERS 300MM,https://www.kennyfuels.ie/product/v-jaw-push-lock-pliers-300mm/
online:en:IE:79693,FAIMFW87W FAITHFULL RADIAL BLADE WOOD WAVY SET 87MM CRV,https://www.kennyfuels.ie/product/multi-functional-tool-crv-radial-blade-wood-wavy-set-87mm/
online:en:IE:79659,FAIJBT101D FAITHFULL JIGSAW BLADES (5) WOOD T101D,https://www.kennyfuels.ie/product/wood-jigsaw-blades-pack-of-5/
online:en:IE:79685,FAIJBT318A FAITHFULL JIGSAW BLADES (5) METAL T318A,https://www.kennyfuels.ie/product/metal-cutting-jigsaw-blades-pack-of-5-4/
online:en:IE:78230,DEWDWFT77100 DEWALT 30M LASER DIST MEASURE,https://www.kennyfuels.ie/product/dewalt-dwht77100-laser-distance-measure-30m/
online:en:IE:80119,DHT043003 DEWALT TORPEDO LEVEL - 25CM,https://www.kennyfuels.ie/product/magnetic-torpedo-level-25cm-10in/
online:en:IE:79703,FAIMFKIT4 FAITHFULL MULTI TOOL BLADE SET FLOOR KIT 4PC,https://www.kennyfuels.ie/product/multi-function-tool-flooring-blade-set-4-piece/
online:en:IE:80060,DHT043224 DEWALT BOX BEAM LEVEL - 60CM / 2FT,https://www.kennyfuels.ie/product/box-beam-level-60cm/
online:en:IE:79683,FAIJBT301CD FAITHFULL JIGSAW BLADES (5) WOOD T301CD,https://www.kennyfuels.ie/product/wood-jigsaw-blades-pack-of-5-8/
online:en:IE:79679,FAIJBT144D FAITHFULL JIGSAW BLADES (5) WOOD T144D,https://www.kennyfuels.ie/product/wood-jigsaw-blades-pack-of-5-6/
online:en:IE:79677,FAIJBT118A FAITHFULL JIGSAW BLADES (5) METAL T118A,https://www.kennyfuels.ie/product/metal-cutting-jigsaw-blades-pack-of-5-3/
online:en:IE:80121,DHT042525 DEWALT 165MM/6.5IN BILLET TORPEDO LEVEL,https://www.kennyfuels.ie/product/billet-level-165mm-6-5in/
online:en:IE:79657,FAIJBT101BR FAITHFULL JIGSAW BLADES (5) LAMINATE/WOOD T101BR,https://www.kennyfuels.ie/product/laminate-wood-jigsaw-blades-pack-of-5/
online:en:IE:80070,DHT010990 DEWALT TOUGHSERIES RETRACTABLE KNIFE,https://www.kennyfuels.ie/product/toughseries-heavy-duty-retractable-utility-knife/
online:en:IE:80091,DHT916852 DEWALT WOOD CHISEL 6PC SET,https://www.kennyfuels.ie/product/wood-chisel-set-6-piece/
online:en:IE:79626,FAIRB51 FAITHFULL ROUTER BIT TC V GROOVE 13.0MM X 19.1MM,https://www.kennyfuels.ie/product/router-bit-tct-v-groove-13-0mm-x-19-1mm-1-4in-shank/
online:en:IE:79855,FAIPLUG12 FAITHFULL PLUG CUTTER NO.12,https://www.kennyfuels.ie/product/plug-cutter-no-12/
online:en:IE:80115,DHT074431 DEWALT V-JAW PUSH LOCK PLIERS 250MM,https://www.kennyfuels.ie/product/v-jaw-push-lock-pliers-250mm/
online:en:IE:79663,FAIJBT111C FAITHFULL JIGSAW BLADES (5) WOOD T111C,https://www.kennyfuels.ie/product/wood-jigsaw-blades-pack-of-5-3/
online:en:IE:80079,DHT010123 DEWALT FOLDING JABSAW AND RASP,https://www.kennyfuels.ie/product/folding-jab-saw-with-rasp/
online:en:IE:79672,FAIJBT119B FAITHFULL JIGSAW BLADES (5) WOOD T119B,https://www.kennyfuels.ie/product/wood-jigsaw-blades-pack-of-5-4/
online:en:IE:80125,DHT014673 DEWALT ERGO AVIATION SNIP - LEFT,https://www.kennyfuels.ie/product/left-cut-ergo-aviation-snips/
online:en:IE:79856,FAIPLUG13MM FAITHFULL PLUG CUTTER 13MM,https://www.kennyfuels.ie/product/plug-cutter-13mm/
online:en:IE:80072,DHT010998 DEWALT RETRACTABLE BLADE UTILITY KNIFE,https://www.kennyfuels.ie/product/retractable-utility-knife/
